{
  "schemaVersion": "1.0.0",
  "runId": "CTR-20260823130806386",
  "kind": "control_plane",
  "dryRun": false,
  "actions": [
    {
      "type": "promote_task",
      "taskId": "BR-0004",
      "status": "ready"
    },
    {
      "type": "dispatch_task",
      "taskId": "BR-0004",
      "ownerRole": "RB-02",
      "ownerActorId": "actor-rb-02",
      "developmentExecution": false
    }
  ],
  "advanced": 1,
  "awaitingPerformer": 1,
  "createdAt": "2026-08-23T13:08:06.386Z"
}
