{
  "schemaVersion": "1.0.0",
  "runId": "CTR-20260823133851862",
  "kind": "control_plane",
  "dryRun": false,
  "actions": [
    {
      "type": "dispatch_task",
      "taskId": "BR-0005",
      "ownerRole": "RB-04",
      "ownerActorId": "actor-rb-04",
      "developmentExecution": false
    }
  ],
  "advanced": 0,
  "awaitingPerformer": 1,
  "createdAt": "2026-08-23T13:38:51.862Z"
}
